{
  "name": "tempo-b-calm",
  "version": 1,
  "fictional": true,
  "from": {
    "brand": "styles/brands/paper.json",
    "motion": "styles/motion/calm.json"
  },
  "color": {
    "canvas": "#F4EFE6",
    "ink": "#1E1B16",
    "muted": "#6F675B",
    "surface": "#FFFDF8",
    "line": "#D9D1C2",
    "accent": "#B5451B",
    "accentInk": "#FFF8F1"
  },
  "type": {
    "display": {
      "family": "Fraunces",
      "weight": 700,
      "tracking": -0.02,
      "files": [
        {
          "src": "../../../../../styles/fonts/fraunces/fraunces-latin-300-normal.woff2",
          "weight": 300,
          "unicodeRange": "U+0000-00FF, U+0131, U+0152-0153, U+02BB-02BC, U+02C6, U+02DA, U+02DC, U+2000-206F, U+20AC, U+2122, U+2212, U+FEFF, U+FFFD"
        },
        {
          "src": "../../../../../styles/fonts/fraunces/fraunces-latin-ext-300-normal.woff2",
          "weight": 300,
          "unicodeRange": "U+0100-02BA, U+02BD-02C5, U+02C7-02CC, U+02CE-02D7, U+02DD-02FF, U+1E00-1E9F, U+1EF2-1EFF, U+2020, U+20A0-20AB, U+20AD-20C0, U+2113, U+2C60-2C7F, U+A720-A7FF"
        },
        {
          "src": "../../../../../styles/fonts/fraunces/fraunces-latin-700-normal.woff2",
          "weight": 700,
          "unicodeRange": "U+0000-00FF, U+0131, U+0152-0153, U+02BB-02BC, U+02C6, U+02DA, U+02DC, U+2000-206F, U+20AC, U+2122, U+2212, U+FEFF, U+FFFD"
        },
        {
          "src": "../../../../../styles/fonts/fraunces/fraunces-latin-ext-700-normal.woff2",
          "weight": 700,
          "unicodeRange": "U+0100-02BA, U+02BD-02C5, U+02C7-02CC, U+02CE-02D7, U+02DD-02FF, U+1E00-1E9F, U+1EF2-1EFF, U+2020, U+20A0-20AB, U+20AD-20C0, U+2113, U+2C60-2C7F, U+A720-A7FF"
        }
      ]
    },
    "text": {
      "family": "Manrope",
      "weight": 400,
      "tracking": 0,
      "files": [
        {
          "src": "../../../../../styles/fonts/manrope/manrope-latin-400-normal.woff2",
          "weight": 400,
          "unicodeRange": "U+0000-00FF, U+0131, U+0152-0153, U+02BB-02BC, U+02C6, U+02DA, U+02DC, U+2000-206F, U+20AC, U+2122, U+2212, U+FEFF, U+FFFD"
        },
        {
          "src": "../../../../../styles/fonts/manrope/manrope-latin-ext-400-normal.woff2",
          "weight": 400,
          "unicodeRange": "U+0100-02BA, U+02BD-02C5, U+02C7-02CC, U+02CE-02D7, U+02DD-02FF, U+1E00-1E9F, U+1EF2-1EFF, U+2020, U+20A0-20AB, U+20AD-20C0, U+2113, U+2C60-2C7F, U+A720-A7FF"
        },
        {
          "src": "../../../../../styles/fonts/manrope/manrope-latin-600-normal.woff2",
          "weight": 600,
          "unicodeRange": "U+0000-00FF, U+0131, U+0152-0153, U+02BB-02BC, U+02C6, U+02DA, U+02DC, U+2000-206F, U+20AC, U+2122, U+2212, U+FEFF, U+FFFD"
        },
        {
          "src": "../../../../../styles/fonts/manrope/manrope-latin-ext-600-normal.woff2",
          "weight": 600,
          "unicodeRange": "U+0100-02BA, U+02BD-02C5, U+02C7-02CC, U+02CE-02D7, U+02DD-02FF, U+1E00-1E9F, U+1EF2-1EFF, U+2020, U+20A0-20AB, U+20AD-20C0, U+2113, U+2C60-2C7F, U+A720-A7FF"
        },
        {
          "src": "../../../../../styles/fonts/manrope/manrope-latin-700-normal.woff2",
          "weight": 700,
          "unicodeRange": "U+0000-00FF, U+0131, U+0152-0153, U+02BB-02BC, U+02C6, U+02DA, U+02DC, U+2000-206F, U+20AC, U+2122, U+2212, U+FEFF, U+FFFD"
        },
        {
          "src": "../../../../../styles/fonts/manrope/manrope-latin-ext-700-normal.woff2",
          "weight": 700,
          "unicodeRange": "U+0100-02BA, U+02BD-02C5, U+02C7-02CC, U+02CE-02D7, U+02DD-02FF, U+1E00-1E9F, U+1EF2-1EFF, U+2020, U+20A0-20AB, U+20AD-20C0, U+2113, U+2C60-2C7F, U+A720-A7FF"
        }
      ]
    },
    "mono": {
      "family": "IBM Plex Mono",
      "weight": 400,
      "tracking": 0,
      "files": [
        {
          "src": "../../../../../styles/fonts/ibm-plex-mono/ibm-plex-mono-latin-400-normal.woff2",
          "weight": 400,
          "unicodeRange": "U+0000-00FF, U+0131, U+0152-0153, U+02BB-02BC, U+02C6, U+02DA, U+02DC, U+2000-206F, U+20AC, U+2122, U+2212, U+FEFF, U+FFFD"
        },
        {
          "src": "../../../../../styles/fonts/ibm-plex-mono/ibm-plex-mono-latin-ext-400-normal.woff2",
          "weight": 400,
          "unicodeRange": "U+0100-02BA, U+02BD-02C5, U+02C7-02CC, U+02CE-02D7, U+02DD-02FF, U+1E00-1E9F, U+1EF2-1EFF, U+2020, U+20A0-20AB, U+20AD-20C0, U+2113, U+2C60-2C7F, U+A720-A7FF"
        }
      ]
    }
  },
  "scale": {
    "display": 1,
    "h1": 0.62,
    "h2": 0.42,
    "body": 0.27,
    "caption": 0.21,
    "micro": 0.19
  },
  "space": [
    4,
    8,
    16,
    24,
    40,
    64,
    104
  ],
  "radius": [
    0,
    4,
    12,
    24,
    999
  ],
  "bans": [
    "centered-title-on-gradient",
    "fade-only",
    "corner-labels",
    "frame-borders",
    "glow-on-ui",
    "particle-burst"
  ],
  "allow": [],
  "motion": {
    "durations": {
      "quick": 240,
      "standard": 520,
      "slow": 1000,
      "hold": 1800
    },
    "easings": {
      "enter": "cubic-bezier(0.2, 0.7, 0.2, 1)",
      "exit": "cubic-bezier(0.4, 0, 1, 1)",
      "move": "cubic-bezier(0.45, 0, 0.2, 1)"
    },
    "spring": {
      "ui": {
        "k": 420,
        "c": 34,
        "m": 1
      },
      "type": {
        "k": 200,
        "c": 28,
        "m": 1
      },
      "heavy": {
        "k": 180,
        "c": 30,
        "m": 2
      }
    },
    "travel": 0.8,
    "overshootMax": 0.05,
    "exitRatio": 0.7,
    "stagger": {
      "eachS": 0.07,
      "capS": 0.6
    }
  },
  "sound": {
    "palette": "soft-ui",
    "bpm": 90,
    "loudnessLufs": -14,
    "cuesPer10s": [
      1,
      4
    ]
  },
  "transitions": {
    "opening": "transitions/hard-cut",
    "topic": "transitions/crossfade",
    "related": "transitions/push",
    "climax": "transitions/zoom-through",
    "outro": "transitions/color-dip",
    "policy": "owns-exit"
  },
  "entrances": {
    "headline": "entrances/rise",
    "body": "entrances/fade",
    "figure": "entrances/count",
    "plate": "entrances/pop"
  },
  "pacing": {
    "holdMinS": 1.6,
    "arrivalsPer10s": [
      2,
      5
    ],
    "energy": "calm"
  }
}
