{
  "name": "kinetic",
  "version": 1,
  "fictional": true,
  "from": {
    "brand": "styles/brands/signal.json",
    "motion": "styles/motion/kinetic.json"
  },
  "color": {
    "canvas": "#0B0D12",
    "ink": "#F2F4F8",
    "muted": "#8A93A6",
    "surface": "#151925",
    "line": "#262C3B",
    "accent": "#D7FF3F",
    "accentInk": "#0B0D12"
  },
  "type": {
    "display": {
      "family": "Archivo",
      "weight": 800,
      "tracking": -0.03,
      "files": [
        {
          "src": "../../styles/fonts/archivo/archivo-latin-700-normal.woff2",
          "weight": 700,
          "unicodeRange": "U+0000-00FF, U+0131, U+0152-0153, U+02BB-02BC, U+02C6, U+02DA, U+02DC, U+2000-206F, U+20AC, U+2122, U+2212, U+FEFF, U+FFFD"
        },
        {
          "src": "../../styles/fonts/archivo/archivo-latin-ext-700-normal.woff2",
          "weight": 700,
          "unicodeRange": "U+0100-02BA, U+02BD-02C5, U+02C7-02CC, U+02CE-02D7, U+02DD-02FF, U+1E00-1E9F, U+1EF2-1EFF, U+2020, U+20A0-20AB, U+20AD-20C0, U+2113, U+2C60-2C7F, U+A720-A7FF"
        },
        {
          "src": "../../styles/fonts/archivo/archivo-latin-800-normal.woff2",
          "weight": 800,
          "unicodeRange": "U+0000-00FF, U+0131, U+0152-0153, U+02BB-02BC, U+02C6, U+02DA, U+02DC, U+2000-206F, U+20AC, U+2122, U+2212, U+FEFF, U+FFFD"
        },
        {
          "src": "../../styles/fonts/archivo/archivo-latin-ext-800-normal.woff2",
          "weight": 800,
          "unicodeRange": "U+0100-02BA, U+02BD-02C5, U+02C7-02CC, U+02CE-02D7, U+02DD-02FF, U+1E00-1E9F, U+1EF2-1EFF, U+2020, U+20A0-20AB, U+20AD-20C0, U+2113, U+2C60-2C7F, U+A720-A7FF"
        }
      ]
    },
    "text": {
      "family": "Manrope",
      "weight": 400,
      "tracking": 0,
      "files": [
        {
          "src": "../../styles/fonts/manrope/manrope-latin-400-normal.woff2",
          "weight": 400,
          "unicodeRange": "U+0000-00FF, U+0131, U+0152-0153, U+02BB-02BC, U+02C6, U+02DA, U+02DC, U+2000-206F, U+20AC, U+2122, U+2212, U+FEFF, U+FFFD"
        },
        {
          "src": "../../styles/fonts/manrope/manrope-latin-ext-400-normal.woff2",
          "weight": 400,
          "unicodeRange": "U+0100-02BA, U+02BD-02C5, U+02C7-02CC, U+02CE-02D7, U+02DD-02FF, U+1E00-1E9F, U+1EF2-1EFF, U+2020, U+20A0-20AB, U+20AD-20C0, U+2113, U+2C60-2C7F, U+A720-A7FF"
        },
        {
          "src": "../../styles/fonts/manrope/manrope-latin-600-normal.woff2",
          "weight": 600,
          "unicodeRange": "U+0000-00FF, U+0131, U+0152-0153, U+02BB-02BC, U+02C6, U+02DA, U+02DC, U+2000-206F, U+20AC, U+2122, U+2212, U+FEFF, U+FFFD"
        },
        {
          "src": "../../styles/fonts/manrope/manrope-latin-ext-600-normal.woff2",
          "weight": 600,
          "unicodeRange": "U+0100-02BA, U+02BD-02C5, U+02C7-02CC, U+02CE-02D7, U+02DD-02FF, U+1E00-1E9F, U+1EF2-1EFF, U+2020, U+20A0-20AB, U+20AD-20C0, U+2113, U+2C60-2C7F, U+A720-A7FF"
        },
        {
          "src": "../../styles/fonts/manrope/manrope-latin-700-normal.woff2",
          "weight": 700,
          "unicodeRange": "U+0000-00FF, U+0131, U+0152-0153, U+02BB-02BC, U+02C6, U+02DA, U+02DC, U+2000-206F, U+20AC, U+2122, U+2212, U+FEFF, U+FFFD"
        },
        {
          "src": "../../styles/fonts/manrope/manrope-latin-ext-700-normal.woff2",
          "weight": 700,
          "unicodeRange": "U+0100-02BA, U+02BD-02C5, U+02C7-02CC, U+02CE-02D7, U+02DD-02FF, U+1E00-1E9F, U+1EF2-1EFF, U+2020, U+20A0-20AB, U+20AD-20C0, U+2113, U+2C60-2C7F, U+A720-A7FF"
        }
      ]
    },
    "mono": {
      "family": "IBM Plex Mono",
      "weight": 400,
      "tracking": 0,
      "files": [
        {
          "src": "../../styles/fonts/ibm-plex-mono/ibm-plex-mono-latin-400-normal.woff2",
          "weight": 400,
          "unicodeRange": "U+0000-00FF, U+0131, U+0152-0153, U+02BB-02BC, U+02C6, U+02DA, U+02DC, U+2000-206F, U+20AC, U+2122, U+2212, U+FEFF, U+FFFD"
        },
        {
          "src": "../../styles/fonts/ibm-plex-mono/ibm-plex-mono-latin-ext-400-normal.woff2",
          "weight": 400,
          "unicodeRange": "U+0100-02BA, U+02BD-02C5, U+02C7-02CC, U+02CE-02D7, U+02DD-02FF, U+1E00-1E9F, U+1EF2-1EFF, U+2020, U+20A0-20AB, U+20AD-20C0, U+2113, U+2C60-2C7F, U+A720-A7FF"
        }
      ]
    }
  },
  "scale": {
    "display": 1.1,
    "h1": 0.66,
    "h2": 0.42,
    "body": 0.27,
    "caption": 0.21,
    "micro": 0.19
  },
  "space": [
    4,
    8,
    16,
    24,
    40,
    64,
    104
  ],
  "radius": [
    0,
    2,
    8,
    16,
    999
  ],
  "composition": {
    "align": "center",
    "headlineScale": 1.2,
    "density": "compact"
  },
  "bans": [
    "centered-title-on-gradient",
    "fade-only",
    "corner-labels",
    "frame-borders",
    "glow-on-ui",
    "particle-burst"
  ],
  "allow": [],
  "motion": {
    "durations": {
      "quick": 120,
      "standard": 280,
      "slow": 600,
      "hold": 1000
    },
    "easings": {
      "enter": "cubic-bezier(0.16, 1, 0.3, 1)",
      "exit": "cubic-bezier(0.7, 0, 0.84, 0)",
      "move": "cubic-bezier(0.83, 0, 0.17, 1)"
    },
    "spring": {
      "ui": {
        "k": 520,
        "c": 30,
        "m": 1
      },
      "type": {
        "k": 260,
        "c": 30,
        "m": 1
      },
      "heavy": {
        "k": 200,
        "c": 26,
        "m": 2
      }
    },
    "travel": 1.3,
    "overshootMax": 0.2,
    "exitRatio": 0.6,
    "stagger": {
      "eachS": 0.04,
      "capS": 0.4
    }
  },
  "sound": {
    "palette": "percussive",
    "bpm": 128,
    "loudnessLufs": -14,
    "cuesPer10s": [
      3,
      8
    ]
  },
  "transitions": {
    "opening": "transitions/hard-cut",
    "topic": "transitions/push",
    "related": "transitions/hard-cut",
    "climax": "transitions/whip-pan",
    "outro": "transitions/hard-cut",
    "policy": "velocity-matched"
  },
  "entrances": {
    "headline": "entrances/slam",
    "body": "entrances/words",
    "figure": "entrances/punch",
    "plate": "entrances/drop"
  },
  "pacing": {
    "holdMinS": 0.8,
    "arrivalsPer10s": [
      5,
      10
    ],
    "energy": "high"
  },
  "finish": {
    "grain": 0.3,
    "vignette": 0.6
  }
}
